,subreddit_class,title,selftext,author,title_word_count,selftext_word_count
645,ohio,tattoo artists for manga panel?,"i'm trying to find a tattoo artist that is good with fine lines, that is good with manga/anime panels. most artists are in california and new york. any suggestions close to or in ohio?",lostkapsule,5,34
646,ohio,it’s funny to see so many ohioans give a damn about michigan this morning, ,noahgula,14,1
647,ohio,"with today's count, do you think that ohio, once america's top swing state, is no longer a swing state?",hardly a dip for trump even with ohio having so much covid lol,gereedf,19,13
648,ohio,secede if trump wins election?,"say you had control over what happens to ohio after trump wins the election. you are given the option to secede. what do you do?

[view poll](https://www.reddit.com/poll/jo17kw)",real_tswany,5,27
649,ohio,weird request- looking to buy a red trump sign,"marketing student that collects interesting marketing materials
 
i've barely seen the sign around and having difficulty sourcing it.

'red trump sign that says keep america great' iirc",zenithace,9,27
650,ohio,just embarassed,once again i find myself embarrassed to live in this fucking state. how we voted in so many twats is mind boggling. from our spineless governor to having to deal with steve chabot once again is just ridiculous. fuck this state.,pnmorris513,2,41
651,ohio,~ could ohio outlaw political parties ? ~," 

# 

philosophically, is the current political set-up of designated political parties benefiting us ohioans ?

instead of our right hand fighting our left hand, what if we used both hands to help our entire collective body ?

would we all, as human citizens, benefit from being less partisan in one direction or the other ?

what if we were all 'independent ?'

i'm actually thinking that individual affiliation greatly reduces our philosophical options, clear thought processes, and opportunities to use government to quickly react to us.

my path has shown me that the question i propose has a lot of validity.

**i'm way better, as a citizen, moving forward as an 'independent'** participant in our political system.",painfullyempty,8,117
652,ohio,"mail in voting, and discrepancy issues, were our votes counted?","hello, ive been voting by mail for over 18 years almost. however i just now checked into trying to understand if my vote(s) were actually counted. 

i used the vote tracker tool from the county website and in all of my mailed in elections going back years, and the status has always been ""accepted for counting""? i emailed the sos office and they responded that after an election is certified the status changes to counted, but that hasn't happened for older elections? 

does anyone else's absentee ballots for lets say 2016 still say ""accepted for counting""? thank you.",jorel43,10,98
653,ohio,just moved here,"so i just moved to ohio and i’m considering the possibility of trying to get a medical marijuana card lol. i was just wondering if anyone else has one, how much did the whole thing cost, how hard was it to get one, and is it just cbd or do they also prescribe the actual flower/plant to?
if i were to try to get one it’d be for stress and back pain, but mainly stress.
i’m not trying to be sneaky about it or smoke one up just because, i’d seriously use it to treat stress/back pain.",mobden3,3,97
654,ohio,"for the first time in 60 years and only the 3rd time ever, ohio has not picked the president.",it really is crazy to think about how accurate ohio has been. until today we were the longest running belweather state and in the top 3 in almost every other category of measuring belweather states.,impy695,19,35
655,ohio,lorain's future?,"hi all, my wife and i live in western ohio and are thinking about a change. we have looked into lorain as it is near my in-laws but not next door, ya know? 

does anyone have insight on the town. we've heard that there are some investments and some rehabbing happening. i'd love to be part of the revitalizion of a town. 

or if you have suggestions of other places in this situation?",topsailsil,2,73
656,ohio,stay safe,hey i just want to say wear your mask and make sure you keep others safe have a bless day.,psalms1000,2,20
657,ohio,about the election,"hey! if you guys are sick of your backwards state against their self-interests election-after-election (seriously, two elections voting for trump by 8 points? more republicans running the state? sherrod's probably gonna lose in 2024?), come move here to minnesota! we're mostly a blue state and aren't seeing brain drain like the rest of the midwest. the twin cities are thankfully big enough to counter-act the rurals, and even our rurals aren't \*as\* redneck as ohio's.

we just need to slip the state senate. which we failed to do this year, but we should get soon enough. just move out of your lost cause, come here to a state actually worth trying to make better.",elektionviewer,3,114
658,ohio,hey trumpers...how you feeling today?!?, ,frankie_nino,5,1
659,ohio,ohio unemployment,me pusieron 56 semanas de penalidad ya he servido 32 el dinero del overpayment se pago en 2019 tengo entendido que las personas que están sirviendo semanas de penalidad son elegibles para el pua pero en el ui aquí en ohio me dicen que no que tengo que completar las 24 semanas de penalidad que faltan una de las personas que me atendió muy arrogante me dijo que me fuera a una iglesia a pedir ayuda y comida llevo 32 semanas en esto sin recibir un solo centavo child support y biles atrasados y ya no se que más hacer en el pua me dicen que me puede. ayudar siempre y cuando el desempleo le de release a mi ss# pero ellos no quieren dicen que tengo que completar las 24 semanas de penalidad que faltan,outrageous_dot_5669,2,136
660,ohio,covid 19 increases,"as covid-19 numbers are shooting up again, i was wondering what we are supposed to do as ohioians. if a family member gets sick, do we have to stay home for 10 days? if we do, do we get unemployment or are we forced to stay home without pay? then what happens if i’m home for two weeks because of a family member, and then i get sick which results in about one month out of work? i’m not sure if this is allowed in this sub but i feel like it is an important pending issue that is going to be very prevalent in our state pretty soon.",tylerc1515,3,109
661,ohio,30[m4f]cincinnati straight m athletic body just horny and bored looking to eat some pussy. im cool with leaving it at that dm me,single bored. and super horny.  im in on the westside of cincy.  if you want you pussy ate like never before hmu. im cool with leaving it at that forreal.  can exchange pics im a good looki g dude.    dm me n snap pics. cant wait,budweisburg44,23,46
662,ohio,voting results by city?,"having trouble finding presidential voting results by city/precinct 
would anyone know where i could find?",eazy311,4,15
663,ohio,repeal hb6! demand your elected officials repeal the legislation before payments begin to be added to your energy bill january 1!!! demand the governor take action now!, ,hutsunuwu,27,1
664,ohio,how is preble county?,"hi guys, my family is thinking of purchasing a house in preble county specifically new paris. can anyone share anything regarding this town? is this area safe or known for crime? my family is asian and with the current political climate, i just wanna know if they'll be ok here.",willchanb,4,50
665,ohio,drug testing for adhd medications?,i've had people tell me with absolute confidence that you do and you don't have to pass a drug test to get adhd meds in ohio. anybody know for sure?,canttaketheshyfromme,5,30
666,ohio,help me help a local mom in need,"hello, everyone i am a teacher at a local nonprofit daycare. i don’t have to tell anyone that has ever worked with kids that you immediately become
invested in them and their well being and a student and his mother could really use some help right now. his mom is the sweetest person/mother you will ever have the pleasure of meeting. she just had a baby  less than three weeks ago and her fiancé just left her and put her out to live in a hotel. now this woman is smart and had saved her money well so she doesn’t need money and soon they will move into an apartment and that’s where they will need help. they are starting over at square one they no dishes or any other things that help make a home a home, no furniture, a lot of clothing had to be left behind. so i am here to ask you good people if there is anything you may have sitting around that a young mother and her children could use to get a leg up. i’d be more than happy to come get it. i appreciate anyone who took the time to read this thanks. joe.

we live near the canton area but i am willing to drive a pretty good distance to get some of this stuff so let me know. 

list of things needed: 
dresser 
dishes 
pots and pans 
cookie sheets 
silverware 
dryer 
loveseat or some kind of sofa? 
some kind of area rug because it looks her room will be in the basement and it will be on concrete floors 
storage for kids toys for a four year old girl and a 9 year old boy.",zerosupervision,8,285
667,ohio,so... we are reopening may 1st... right?, ,lifeasagayman,7,1
668,ohio,"""break in claim"" on unemployment but i file every week","yet another unemployment issue. i have filed every sunday for the last three weeks, on the dates it tells me i'm required to do so. i answer all the questions correctly and when i initially filed i used the covid number dewine issued. each time i check my claim status it says ""break in claim"" and i do not receive any unemployment benefits. i already tried to resubmit my application and it did nothing. i got an email saying i was approved and that i would be getting back payments but it's been  three weeks since then. am i doing something wrong? google says break in claim means i failed to file a weekly claim but i haven't, as i said i file every sunday on the date it says. should i keep trying? does anyone have any advice? thanks in advance.",angieohno,10,142
669,ohio,ui system crashes this morning...,"if you're wondering why today is an exceptionally difficult day to get through to rectify issues with your ui benefits via chat or phone lines, they are apparently experiencing system crashes today. i also found out that the pin chat is willing to help with issues unrelated to pins, but not today as they can't access any claim files due to system crashes. hang in there peeps, it's back to the phone lines for me, the lady in the chat mentioned the phone lines offer more solutions than she is able to despite their server issues so it's worth giving that a try.",sudestbrewer,5,103
670,ohio,the governor's 4/14 coronavirus briefing will begin soon as of 2:00 pm,"streaming at https://www.youtube.com/watch?v=yhp1eutirdi and http://ohiochannel.org/governor-live-stream.html

i recommend using the youtube link.

i will be keeping this post updated with a summary as it continues. things i find most important will be bold. keep in mind it will often be paraphrased. the stream itself is the best source.

previous streams can be found here: https://www.youtube.com/channel/ucporaxceaojgzkz7y3c0zbg

thank you for all the awards and other offers but please save your money for the future economic uncertainty which is likely going to occur.

ohio: 7,153 confirmed cases (127 with extra probable cases), 309/7,153 confirmed deaths (with 15 extra probable deaths), 2,156 hospitalizations, 654/2,033 in the icu 

united states: 580,878 confirmed cases and 23,607 deaths.

i will place the cases going back to march 11th in a comment in order to save space.

here is a link to a google drive that shows the history of cases and deaths created by /u/kcmasterpiece347: https://docs.google.com/spreadsheets/d/1cngx6algsyiwzctchwsq-udrq8jezhus9i_1ovnkb4s/edit?usp=sharing

here are some graphs showing the latest information created by /u/st1tchy: 

4/7: https://imgur.com/bx95viu

4/8: https://imgur.com/odp8nfu

4/9: https://imgur.com/bxtpvzi

4/12: https://imgur.com/zu2g5dp

4/13: https://imgur.com/vqyulzp

4/14: https://imgur.com/kd43gky
______________________________________________________________________________
2:05 pm: the governor begins speaking

today, i'm wearing a wright state university tie.

we are submitting a medicaid waiver application to the federal government in order to bolster telehealth, waiving signature requirements, easing obstacles to getting care in a nursing home, and access to alternative locations.

i want to help all of our mayors and local leaders as they report what's going on at a local level. i believe they are helping me and the rest of the state with all they're doing. 

i'm going to have andy ginther, the mayor of columbus to talk about what's been going on, including our build-out plans for hospitals. 

2:14 pm: the governor stops speaking
______________________________________________________________________
2:14 pm: andrew ginther, the mayor of columbus begins speaking

i had the opportunity to tour one of our build-out sites and it was simply amazing how quickly this has been done and how collaborative our hospital system has been. we're getting calls throughout the state and the country on how to do this sort of thing. i'd like to thank the national guard as well for their tremendous support. our greatest hope is that we never have to open these build-out sites and it's possible we won't if you keep following the stay at home orders and other guidelines. 

we're constantly focusing on collaboration and working for the common good. battelle is one example of a company that is doing what they can to keep ohioans safe but there are many companies throughout the state that are doing the same. 

while i'd like to open up the state as soon as possible, we absolutely must follow the advice of the medical community. we have to do this the right way to avoid a second surge. with this recovery, we have to keep in mind that not everyone is on the same level right now in terms of healthcare and that we must ensure that they are properly taken care of as well. 

2:20 pm: andrew ginther, the mayor of columbus stops speaking
_______________________________________________________________________________
2:21 pm: the lieutenant governor begins speaking

i'm going to give a report of some of the tools we have implemented in the past few weeks.

the dispute resolution commission has had 194 issues they were requested to take care of  142 of those did not meet the criteria, 27 are under review, in 15 there was a conflict but it was taken care of at the local level. less than 10 have been ruled on in total so far

the office of small business relief has been sending out forgivable loans to small businesses throughout the state. it has helped 1,300 businesses so far.

i want to mention that along with the medical community, we are speaking to the businesses community in order to figure out what works and will work best to protect our economy. i always get asked when we're opening back up and i'd just like to say that i think we'd all love to know that answer. this isn't going to be a switch on from off. we have evidence of how the best practices are protecting workers and lowering the human and economic costs of continued operation. businesses need to ensure that they follow those best practices when the state reopens so that those practices can work with you as well.

there are more than 41,000 jobs in several industries that are critical to the continued operation of our supply chain.

2:30 pm: the lieutenant governor stops speaking
____________________________________________________________________________
2:30 pm: amy acton starts speaking

we hope that we've reached our plateau and hopefully that's the worst we'll have to face.

7,153 confirmed cases (127 with extra probable cases), 309/7,153 confirmed deaths (with 15 extra probable deaths), 2,156 hospitalizations, 654/2,033 in the icu, 1,534 of those infected were health care workers, 67,874 total tests

high risk categories that can cause increased risk of death include chronic lung diseases, moderate to severe asthma , obesity, diabetes, kidney disease, liver disease, heart conditions, and those that are immuno-compromised.

we will be issuing a new order in order to protect first responders. we are sharing information on the locations of positive cases with first responders, while still keeping that information as confidential as possible to protect privacy. 

we're still working on a plan for the recovery phase, but we have also created a collaborative environment throughout the ohio healthcare system, that we believe will be ready to go out to hot spots as they appear throughout the state. we've won the first battle but this is a war. we cannot stop just yet. this is a long road and there are more battles we have to fight. this hospital buildout is in preparation of those future battles that will appear as spikes in cases and possible deaths. 

staying at home is just as important as ever but i want you to remember that while we have to keep distance from each other that staying social with those you know is still important for everyone's mental health. i think we all feel angry about what is going on. i feel angry every moment i know that we don't have the exact details of this virus just yet. staying social will help you with that as i think it's helped me.

2:40 pm: amy acton stops speaking
_________________________________________________________________________
2:40 pm: question period begins

50 people from a small business have applied for unemployment and only four of the 50 have received the benefits they need. what do you have to say about that?

governor: this is very concerning and i apologize to those 46 individuals. i can go into the reasons why this is happening but i think what you want is for us to fix this and we're doing everything we can.

lieutenant governor: every time i hear a story like this i get even more frustrated because this isn't acceptable in any way. this is a difficult time and i feel the responsibility to help our citizens. i am not satisfied. i want to present more answers as to what is going on with our system but i'm going to take another day to figure this out. until then i will be doing everything i can to fix this.
____________________________________________________________________
2:44 pm: what would you say to the kids who are stuck at home and don't really understand any of this?

amy acton: i've thought about that a lot. we have to create new normals and routines without causing fear. unfortunately, kids are perceptive and can see our own fear and that makes everything even more difficult. i want to learn from the past and that tells me that this won't be a quick path. this is unsettling at the least, the job losses and the loss of stability are hurting our children. i hope that i will be able to find better answers and i will share everything i know as i know it. this isn't something i can look up and get an answer, it takes much more than one person to understand at this time. all i can say is that everything we've done in ohio has saved lives and we need to keep moving. we're still short on ppe and testing, two things that are essential to getting us to a place that will allow us greater freedoms. the best minds are working together on this. we're sticking with you as this goes on.
________________________________________________________________________
2:49 pm: what are you looking for to reopen? is there a magic number?

amy acton: what i know and what is agreed upon is a sustained decrease. ideally, we would like to contact trace everyone. i know we won't get to absolute zero. what i'm building is the ability to get the best numbers possible. we still don't have enough testing to figure out the total infected cases throughout the state or the country. each day we're gathering the best data we can and following trends, while we have eyes on the dashboards that are focusing on higher-risk areas so that we are ready to respond as necessary. we will need to build our infrastructure to fight against this illness. we are at the cutting edge of these discussions.
____________________________________________________________________
2:53 pm: what do you think about reopening college campuses? how will they practice social distancing?

governor: it's far too early to make any decisions about fall term. i don't know where our numbers will be, especially our number of tests. no matter what, when our education system reopens, the students' experience will be different. this may be difficult to accept but until we get a vaccine it will be a different environment. everyone needs to think about how to keep everyone safe when all of these industries and systems reopen. you need to start thinking about this right now. when is an important question but how is the question you need to focus on right now. everything looks good but our citizens are still dying and it's still very dangerous. i apologize for the long answer but this is what we need to focus on.
________________________________________________________________
2:58 pm: what budget cuts are you going to be a focusing on?

governor: we're not prepared to make an announcement on our budget cuts just yet. the highest priority is to keep the essential areas that are focusing on the coronavirus as funded as possible.
___________________________________________________________________________
2:59 pm: what kind of efforts are being made to keep grocery stores supplied with health supplies?

governor: we're all doing what we can. some stores are doing it themselves. we're also providing help as possible.

lieutenant governor:  our businesses are creating protocols, buying stock, organizing teams, and just doing everything they can to reopen. we cannot open until these businesses have completed that process. we have some amazing companies that are working globally to keep themselves open and prepared to be reopened. 
________________________________________________________________________
3:05 pm: we're hearing reports of families of individuals in nursing homes that have been waiting for days for test results. what do you have to say about that? should families be informing you about this?

amy acton: we have done a lot to keep things like that from happening. i'd like to hear more details.

governor: we have the capacity to get these tests back quickly. there is a problem there and i want to know what's going on. 

absolutely let us know if there are testing delays.
_______________________________________________________________________
3:07 pm: how will we avoid the coronavirus coming back into ohio after we reopen?

governor: we're used to a quick win but this monster will be with us until we get the vaccine. people are going to have to be careful. those in high-risk populations should probably avoid putting themselves in dangerous situations. this isn't just going to go away for quite some time. 
__________________________________________________________________________
3:10 pm: you have built up goodwill among ohioans but do you believe you will see a growing backlash as this goes on?

governor: i understand and see how this is frustrating. i want to get everything back open but i think that even if i opened everything up, people wouldn't go out at the same rates as before. i want to make sure everyone is feeling as safe as possible. this will definitely be not be like it was before.
__________________________________________________________________________
3:14 pm: is there anything you can share about the increase in deaths? is this a trend that will continue?

governor: i sure hope not. this is a lagging indicator of what's actually happening throughout the state. hospitalizations are a much better indicator. 
____________________________________________________________________________
3:16 pm: clarification on the death rate that was mentioned. do you believe that we'll continue to be below the models?

amy acton: i think that this is a reporting issue that i'll look into

governor: we'll look into this.

models can only do so much. the original models were based on no mitigations and the newer ones focused on certain amounts of social distancing. 

amy acton: numbers are being updated at 2 pm and i think that's the issue. our reality is that we're going to stay at this rate of infection and hospitalization. deaths are going to lag behind everything else.
__________________________________________________________________________
3:21 pm: do you believe our sports will reopen in the summer or the fall?

governor: i don't know.
_______________________________________________________________________________
3:23 pm: when will you be signing the order regarding nursing homes? is there a regional reopening plan?

amy acton: i believe we're still preparing it and i'll sign it as soon as possible.

governor: unfortunately, we have to have the lawyers involved regarding that order.

i've spoken to the governors of surrounding states. we have no formal plan but we're definitely communicating, including in a call i had this morning.

amy acton: i've been communicating with departments of health throughout the country. we're working together to get this done.
__________________________________________________________________________
3:27 pm: question period ends
___________________________________________________________________________
3:27 pm: the governor begins speaking

unfortunately, the special olympics will not be running this year. however, that organization is doing work in a virtual environment to keep their community healthy. i will be showing a video by a special olympian now.
_____________________________________________________________________________
3:30 pm: the stream ended",peaceissoftcorewar,12,2372
