,subreddit_class,title,selftext,author,title_word_count,selftext_word_count
312,ohio,breakdown of changes to the law in ohio regarding carrying a concealed weapon,"some of the news coverage on this issue has not been complete and make people think the law did more than it actually did so i wanted to do a breakdown so everyone can be properly informed.

the law that was passed is sb215 and can be found [here](https://search-prod.lis.state.oh.us/solarapi/v1/general_assembly_134/bills/sb215/en/05/sb215_05_en?format=pdf).

the bill made two big changes. first, anyone can carry a firearm concealed without a license though this comes with restrictions i'll get into later. second, a person is not required to disclose to an officer that they are in possession of a firearm unless asked. 

the first part comes from a new law created by the bill. this new law is o.r.c. 2923.111. it basically states that for the purposes of the ccw statute (2923.12) everyone is considered to have a ccw license so long as they are 21 or over and have no disqualifying conditions that would be found under 2923.13 (hwwud) or 18 u.s.c. 922(g)(1)-(9). 

the issues that can cause a disability under 2923.13 are: 
1)	the person is a fugitive from justice.
2)	they are under indictment for or have been convicted of a felony offense of violence, or adjudicated a delinquent child for an offense of violence.
3)	the person is under indictment or has been convicted of any felony offense for the possession or trafficking of a drug of abuse or has been adjudicated a delinquent child for what would be a felony offense for the possession or trafficking of a drug of abuse.
4)	the person is drug dependent, in danger of drug dependence, or a chronic alcoholic.
5)	the person is under adjudication of mental incompetence, has been adjudicated mental defective, has been committed to a mental institution, has been found by a court to be a mentally ill person subject to court order or is an involuntary patient other than one who is a patient only for purposes of observation.

18 u.s.c. 922(g)(1)-(9) is the federal statute that prohibits firearm ownership. the issues that would cause a disability under this statute are:
1)	a person with any felony conviction
2)	a person who is a fugitive from justice
3)	a person who is an unlawful user of or addicted to any controlled substance
4)	a person who has been adjudicated as a mental defective or has been committed to a mental institution
5)	a person who is illegally or unlawfully in the united states or present in the us on a nonimmigrant visa
6)	a person who has been dishonorably discharged from the armed forces
7)	a person who has renounced their us citizenship
8)	a person subject to a protection order issued to protect an intimate partner or child of the person
9)	a person convicted of a misdemeanor crime of domestic violence

it should be noted that the disabilities under 18 u.s.c. 922(g) already kept someone from having a ccw license prior to the law change.
 
in my opinion, the thing that so often gets left out of news articles on the law is that it is still illegal to have a loaded firearm ready at hand in a motor vehicle. the only change to the improper handling law, r.c. 2923.16, was to no longer require a person to volunteer that they have a firearm with them in a car. all the other parts of the law were unchanged. so you still need to obtain a ccw license in order to possess a loaded firearm in a car. and to be clear, if the gun is in your center console, and the loaded magazine is in the glove box, then the gun is considered loaded under the law. 

now here's some general stuff to be aware of:

you still can't possess a firearm in a bar, a school safety zone, or a courthouse. a gun may be possessed at a private or public university if a written policy or rule permits it. same for a church or government building. a private employer may also prohibit firearm from the premises. you also may not possess a firearm while intoxicated. 

i hope this summary is helpful.",beiki,13,684
313,ohio,usa: voting analysis: how the hell do you hold elections in a state without districts?,"
https://www.thedailybeast.com/how-the-hell-do-you-hold-elections-in-a-state-without-district-maps?source=politics&amp;via=rss",motor-ad-8858,15,1
314,ohio,ohio court laws for 18 yr old.,"hi, i am 18 and just received a minor misdemeanor due to my friend speeding with marijuana in the car. my mom has the ticket and called for me just to see if i can waive the court date and just pay the fee. i have to go into court still. my mom didn’t pay the ticket or speak on my behalf at all, just called for basic info. my friend just informed me that it was illegal for her to call because i’m 18. i didn’t know or think it would be since she didn’t do anything for me, just called about info. i tried looking online and found no info as to if that is illegal, and now i’m kinda freaked out. i’m already in trouble and i don’t wanna get in trouble for something else i didn’t even know about. if anyone knows the answer to this please let me know, thanks!",either_lengthiness23,7,155
315,ohio,"taking my kids to nfl hall of fame, anything else to do?","from chicago. my kids are on spring break, and my wife is prego and not feeling great. decided to book a hotel and buy tickets to the nfl hall of fame. kids are excited and wife is happy to have three days of peace. is there anything else fun to do that an 8&amp;11 year old would like? i found some castle that does friday tours, they seemed excited about that. any must try foods or beers? will also have a 1y old baby with us so can’t do anything too crazy like paintballing.",hendrixsrv3527,12,94
316,ohio,anyone needing a job apply to your local take 5 oil change. they have good benefits full time work and if your in a rut they can really help you move forward in life., ,zenpakusen,34,1
317,ohio,scenic driving routes in ohio?,what are some of the best driving spots in ohio? i live in columbus. i always loved going out and driving through the forests and mountains near the border of wv. unfortunately i drive an electric vehicle now and prefer to stay at least within 60ish miles of a tesla supercharger. so most metro areas.,pressedgarlic,5,55
318,ohio,southern ohio original covid.,"my wife just got back from the er.  we all thought we had the flu.  the doctor used a pcr test and she came back positive for the original strain.  i was tested as well, waiting on results.   i’m honestly just curious if it is indeed the original or a mutated variant that’s just close enough to the original to cause a positive result.  i wonder if they’ll send her sample out to be analyzed?  the mapping process is interesting to me but i have no training in virology or microbiology.  

good news, she was negative for the flu!",-darknessfalls-,4,99
319,ohio,i'm swinging democratic after watching the debates,"intesenate and governor races have a better option than the repuresting how channel 4 would have nothing to do with broadcasting the democratic debates so i watched them elsewhere.   both the blicans.  time for change.
either the mayor of dayton or cincinnati for gov.  i'm not positive which one yet.
morgan harper for senate.
watch the videos for yourself.",orient43146,7,59
320,ohio,my punk band is looking for a venue,"hello ohioans! my band has had a lot of success playing shows at our high school, but we're trying to expand our horizons a little. does anyone know of venues in ohio that are looking for bands?
ps none of us are over 21 so bars are not an option as far as i'm aware",smotonthegood,8,55
321,ohio,"for all of you who say ""it's ohio weather, it will change tomorrow."" boy were you right.","after 24 hours of 30 mph winds, we now have 30 mph wind and rain.",nachobag_clip932,17,15
322,ohio,festival of columbus in columbus on campus! - everyone invited!,"this weekend we are having the festival of colors together on the osu campus! this festival is celebrated all throught india for centuries and throughout the world,very festive and a great time for everyone.

we are excited to invite all of you on april 2nd, saturday to join the celebration from 4 to 7 pm. this festival marks the beginning of spring after a long winter, symbolic of the triumph of good over evil. it is a celebration of joy, unity and love.

come eat delicious snacks, watch vibrant performances, learn more about the rich history and background of holi, and enjoy color throw! event is open to all.

what to wear: anything you dont mind getting color on :-) - (most colors come off with wash though)  
**entry free!**

**$3 per person for food and color bag.**  
**venue- morrison tower courtyard**

**time: sat april 2nd, 4 to 7 pm**  
event rsvp link :  [http://go.osu.edu/holi22](http://go.osu.edu/holi22?fbclid=iwar0vlot83y02wl-lo6bfjklmtuwggrqfrea3ltqsy1dmxc8srrfaje8snac)

the first 50 to sign up gets a free white tshirt from osu.!

invite all your friends!

**follow us on instagram for more info:**  
[https://www.instagram.com/consciousosu/](https://www.instagram.com/consciousosu/)",jorurney_within_1999,10,180
323,ohio,both sides do it.,"https://news.yahoo.com/judge-rejects-yorks-redistricting-plan-211124651.html

for all those  who think that republicans are the only ones who do this...
democrats have been doing just as much and just as long.
fyi i'm not a republican or democrat. i don't support either wing of the same bird, i want real choices and changes.",e_rep61,4,48
324,ohio,information about mma promotions in ohio,"hello guys! i am writing an article about some mma promotions in ohio, but as i am not from around there and cant seem to find much on the internet, i was hoping if anyone could share any information about ohio combat league, mma brawl room (aka yankee lake brawl room) and caged thunder. thanks in advance!",whitelotus96,6,57
325,ohio,video - nan whaley is running for ohio governor 2022,"video - [https://youtu.be/oj92iylzd5m](https://youtu.be/oj92iylzd5m)  
for the last seven years, nan whaley has served as the mayor of dayton, ohio. she’s faced some of the toughest challenges — a mass shooting, the opioid epidemic, tornadoes, a broken economy, and the covid-19 pandemic. through it all, dayton has come out stronger and more resilient thanks to her leadership. we are a grassroots group and not affiliated with the campaign.

https://preview.redd.it/efktdbum8yq81.jpg?width=3480&amp;format=pjpg&amp;auto=webp&amp;s=4705e9fe59a81cd02eddb5c9147ad7e31658f024",youcantbeatblue,10,67
326,ohio,buzzards back in novelty, ,mother_put7152,4,1
327,ohio,loving the representation in r/place. i've been working with everyone. i really hate this because i didn't get shit done two years ago either., ,ralph--hinkley,24,1
328,ohio,lets invade the mets in r/place,"&amp;#x200b;

[more room for us](https://preview.redd.it/zjsi4xuadzq81.png?width=771&amp;format=png&amp;auto=webp&amp;s=32a2627886217676f0320c3f6ac979cecb4ef63a)",probablynotrayzyr,6,5
329,ohio,"hey all, r/scottthewoz here. we were wondering if you wanted to form a mutual defense pact with us. our current point is at (640,975). with our close vicinity and with scott wozniak being a loyal member of the greatest state, we thought this would be a perfect alliance in r/place.", ,practicalearth135,50,1
330,ohio,protect ohio,"&amp;#x200b;

https://preview.redd.it/th0drdlxmzq81.png?width=1293&amp;format=png&amp;auto=webp&amp;s=0a10d058500b99e2227c2c5d11430f0a0b5bba64",suspicious_snoman,2,2
331,ohio,hold ohio,hold on /r place,ohiowastaken,2,4
332,ohio,because we lost ohio destroy michigan, ,ohiowastaken,6,1
333,ohio,calling all active ohio members,"we must regroup and re-strategize on how we will make are mark on r/place 

my suggestion is to move are spot to 653,967 right now there is nothing there(just a giant blob of green and dots)  and it looks free for the taking. are neighbors also look pretty friendly about borders lets all band together to make this 

https://preview.redd.it/evyrnl2970r81.jpg?width=960&amp;format=pjpg&amp;auto=webp&amp;s=2d4d117f728edb2c0eee1ee1a5353a3b27fff6e5",operation15,5,59
334,ohio,"looks like we have enough space for the flag next to the word ""ohio""",lets make it,ohiowastaken,14,3
335,ohio,fun place to hike/walk around this weekend? (ne oh),"can y’all give me any good ideas for a pretty place to go this weekend to hike and/or walk around and explore nature? in northeastern ohio, or at least within reasonable driving distance of ne oh. thanks! 🤗",motor-corner4861,9,38
336,ohio,here,[https://clips.twitch.tv/ramshacklekawaiitraymcat-o85j7ori5nlz2rbh](https://clips.twitch.tv/ramshacklekawaiitraymcat-o85j7ori5nlz2rbh),k1ixk,1,1
337,ohio,deo yrg ohio truce,we have cleared a place under for yall to take stop messin with our area,heyimdirty,4,15
338,ohio,aye this man josh and raymon need to be stoped we must fight backk!!!, ,kaythreebih3,14,1
339,ohio,ohioans,ya'll best take uganda cause deo x yrg not moving we gotchu if you got us we will truce in bruce we trust,organic_put3747,1,23
340,ohio,chill out,y'all aint fuckin with big yrg fuck yall talmbout,danny_babanny305,2,9
341,ohio,listen here pussies,"yrg x deo solos, now stfu and suck these fat nuts",theshujiin,3,11
342,ohio,yrg x ohio truce,yrg we accept the truce,realdatboimudkip,4,5
343,ohio,yrg don’t want war unless you guys don’t listen put ohio under yrg and we’ll protect you, ,trentonnnnnn_,17,1
344,ohio,they waged war and tried to tell us to move. this won't be tolerated. come back oh,"&amp;#x200b;

https://preview.redd.it/8au5f6rd71r81.png?width=697&amp;format=png&amp;auto=webp&amp;s=88f9fea4b28cffd1ffd8d525ec2b65a5c45b34a3",sreksworb,17,2
345,ohio,yrg truce,"as a member of the ohio community, i say we accept yrg’s offer and make peace to protect each other",randomblaxkguy,2,20
346,ohio,"uganda fell off, we officially accept yrg’s truce🤝", ,bdeolilnbestfriend,8,1
347,ohio,yrg,deo x yrg on top,papi_2damoon,1,5
348,ohio,lets make alliance heart,ok now that ohio is built lets make an alliance heart with deo x yrg,equivalent-tourist28,4,15
349,ohio,what is the yrg posts, ,ghostfacedhonda,5,1
350,ohio,ohio,y'all like the new home we gave y'all,vtxkeoverr,1,8
351,ohio,"alfa(alpha) city, ohio location","where exactly is alfa(alpha) city, ohio located?",alone-peach2592,4,7
352,ohio,"famous people in alfa(alpha) city, ohio","which famous people are from alfa(alpha) city, ohio?",alone-peach2592,6,8
353,ohio,any musicians wanna like...hang out? (cleveland),"cleveland lowkey bores me. i need actual musicians to hang with. i play piano, sax and soon flute. just wanna meet some cool folk is all.",some_bizarre_guy,6,26
354,ohio,help for making hulu ad video 30 sec. ad,"we are a small $1 mill annual sales business - trying to comply with hulu advertising guidelines for 30 sec. video ads. we create with biteable app. , but our ads do not comply with their requirements. any suggestions where or who can help us. we are not expecting free services, but don’t know where to turn. cannot afford hollywood agency - any independents can help us ?",hugefudgelover,9,68
355,ohio,"375, 267, ohioans, let’s make a “go bucks!” on r/place", ,thevampireitself,10,1
356,ohio,rita refund for wfh?,"has anyone gone through the process of requesting a refund due to working remotely all of 2021? was it as painful as dealing with rita typically is? i looked online and it looks like you need to fill out a form and mail it in.

i’m wondering if i would be eligible for one if i lived in a different city (still in cuyahoga though) than where my employer is based.",lower_balance2088,4,71
357,ohio,ohio news,ohio isnt real,working_mud_2861,2,3
358,ohio,think about it,ohio dollars,nathan578,3,2
359,ohio,hey y’all. tia,"i just recently moved up here not too long ago, i’m wondering where the best hiking areas are near here. similar kinda hiking to places like hocking hills state park. been searching but just cant find what i’m looking for. i’m from cincy, so preferably nothing back down that way, i’m looking more in every other direction. thanks again for any help.",jxmmybear,3,62
360,ohio,can a 20 year old enter a club or bar in ohio? (without drinking),"i am moving to dayton ohio and where i am from, you can be 20 to enter a club or bar but can’t order or drink until 21. is this the same for ohio or is it different?",misd1598,14,38
361,ohio,parental rights in education,"i'm a public school teacher, and i'll teach your kids the truth whether you give me your permission or not. 

right now we're arguing about teaching kids about racism and sexual identity. next you'll be telling me i can't teach your kids about evolution, abstract art, poetry, or interpretive dance. 

i have an advanced degree from a prestigious university, and a license from the state. if you are going to tell me what to teach, who do you think you are?",gork614,4,81
362,ohio,two weeks from today - ohio cannabis lobby day at the ohio statehouse - please join us," 

exactly two weeks from today at the ohio statehouse, a coalition of marijuana rights legalization advocates are rallying at the statehouse to lobby our representatives to legalize marijuana in our state. this lobbying effort is led by norml appalachia of ohio, the only norml organization in our state.   
a variety of civil rights activists, cannabis businesses, state representatives and state senators, and members of the public are expected to attend and speak. politicians are welcome too, if you or someone you know is running for office and supports legalization, feel free to attend.  
whoever you are, if you live in ohio and you support marijuana reform, please consider attending. let’s show the lawmakers and the media that the people of ohio want legal marijuana. \*\*let’s fill the statehouse.\*\*

you can rsvp to the facebook event - \*\*ohio cannabis lobby day\*\*

otherwise, just show up to the statehouse at \*\*1 capitol square, columbus, oh 43215\*\* between \*\*9:00 am - 3:00 pm.\*\*

a copy of our speaker schedule is also available  on our facebook page - \*\*norml appalachia of ohio\*\*

if you can’t attend in person, but you want to attend in spirit, you can consider becoming an official member of \*\*ohio’s only norml chapter\*\*, or making a donation. even $4.20 helps. we’re entirely volunteer run and basically all of our money goes to lobbying fees, petition filing fees, and cannabis outreach and activism. 

\*\*\[https://www.normlappalachiaohio.org/\](https://www.normlappalachiaohio.org/)\*\*",smigelski-78,17,233
363,ohio,buddhist temples in oh? seeking friends and to visit temple,"not sure if this is allowed but anywho - i’m looking for others who may know of / want to go / already participate in buddhism + visiting the temples.

i relate to a lot of the teachings naturally and want to learn more and see what i feel. 
i’d love to give back to community and make friends here. :)

( 30 female btw )

names emily",pain_choice,10,68
364,ohio,not as good as michigan.,i'm jus saying ..... u guys did lose the war.,jesusleftnipple,5,10
365,ohio,suggestions on surveying ohio residents?,"looking to survey ohio (primarily columbus) residents on their dog park usage. does anyone have any suggestions, companies, on forums on the best way to go about that?",mrsnazzygoose,5,28
366,ohio,double egg yolk 4 times in a row,so in 2 separate days i’ve cracked 4 eggs and all of them were double yolked. we get the same kind of eggs every time and it’s never happened. my sister thought that the carton was meant to be doubled yolked so i cracked an egg and it was double yolked and my sister cracked one too and hers was single. tell me that’s not weird lol.,huge-signature1375,8,67
367,ohio,has this subreddit always been so political?,"i originally joined to learn more about the state of ohio: culture, things do so/see, local history maybe.

now it seems like every other post is about politics?",jmfox2294,7,28
368,ohio,attention weirdos in ohio.,"just to get it out the way i'm an african american man who lives in slyvania. so if you disagree i get the honorable pleasure of calling you a racist. is that how it works nowadays..? 
i say no to this new anti-pedo bill. i believe all teachers should teach every kid anything they want. gender, trans, race blah blah. we all know how important those things are when the children one day integrate into society. fuck mathematics! gib me da blm and lgbt issues! 
more to the point, get off ya lazy assess and protest! like in real life. burn the politicians houses down if you have to. teachers are the new god, we as parents have no say. period.
when you are successful and every kid wants to be lgbt and/or black.. the world will be a much much better place. 

obviously.

i'll be home schooling my kids personally but eh.
seriously stop complaining on the web goofballs. these kids can't learn about the struggles of the blacks and lgbt people through reddit.
silly woke people.

have a great day.",flatre_fonda,4,182
369,ohio,any abandoned spots near cincinnati,i used to do a lot of urban exploration in ukraine but since i moved i’ve wanted to check out some places in cincinnati but haven’t had much luck (17 btw),emotional_whereas_12,5,31
370,ohio,loud noise,anybody in ohio just hear a super loud noise in the sky? happened about 9:40pm.,pokemontrainerjanos,2,15
371,ohio,"any local authors, i have a book idea.... (political)","somebody needs to write a real book about rob portman's time in office. this book needs to be written asap because we all know when he retires later this year as he will probably have a book ghost written that whitewashes his record.

the book can be called ""late for lunch: a history of cowardice and partisanship"". if you don't undeestthe title google portman late for lunch. topics can be his blatantly passive and sometimes aggressive racism. his repeated defense of sexual predators along party lines, his hypocrisy and immigration,  his hypocrisy on ukraine, his hypocrisy on lgbtq rights, his refusal to meet with his constituents for over 7 years. his hypocr6and outright lies about the supreme court and so on.",xenochimp,9,121
372,ohio,"hey everyone! we enter your information and find you the best rate. you get quotes for safeco, progressive, allstate, nationwide, grange, and the list goes on. let me know if you want a free quote to save money, it’s quick and painless!! we can save you money today! message me for details.", ,emotionalleg9065,52,1
373,ohio,help finding a burial site?,"hi, i'm trying to find my friends grave and have had 0 luck. even with my fairly extensive knowledge on how to find something through google, burial sites aren't something i've really ever tried to find.

i apparently don't really understand how to search through burial records. at least online.

 i literally cannot find any information on where he's buried.

so if anyone who's good at that kind of thing could help, it'd be greatly appreciated.

thanks.",_alice_liddell_,5,77
374,ohio,"yo, ohio, why you trying to be a secret?","bro, i was sleeping on ohio. my dumbass was building sandcastles in florida until i got a job up here. and, you know what, this place nice as hell. why y’all trying to keep this a secret? what you hiding up here? the food is good. the housing is relatively inexpensive. the wages - at least in my field - are decent. granted, i’m gonna be freezing my ass off once it hits 65, praying to buddha, tina turner, and hot sauce just to feel warm. but this place is chill. 

why you so underrated, ohio?",simple-matrix,9,96
375,ohio,it's that time of year.,"the brown county fair is on. [https://www.thelittlestatefair.com/](https://www.thelittlestatefair.com/)  and

pumpkin run is on. [https://ohio.org/wps/portal/gov/tourism/festivals-and-events/events/pumpkin-run-nationals](https://ohio.org/wps/portal/gov/tourism/festivals-and-events/events/pumpkin-run-nationals)",buford12,5,13
376,ohio,"might be a first time car owner next year, what can i expect for the upfront costs after ownership is signed over?","i am a vastly inexperienced driver, never had a license and even have an unauthorized use of motor vehicle on record, i am in my upper 30's. 
i have a chance to buy a car off of a family member. i wish to know what i might be getting into, temps, driving test, registering and insurance. 

its a pontiac gran prix so nothing new or pricy.

are temps reserved only for teens or can anyone apply for it regardless of age?

is driving school an option for lowering insurance costs? how much does that usually run?",straypuft,22,96
377,ohio,where can i get the best pizza in ohio, ,negotiationweird1065,9,1
378,ohio,defiance woman's remains found inside columbus condo," 

# 

[https://www.wtol.com/article/news/crime/defiance-womans-remains-found-inside-columbus-condo/512-021c55dd-d64a-48fa-9b6f-d825fe7d501c](https://www.wtol.com/article/news/crime/defiance-womans-remains-found-inside-columbus-condo/512-021c55dd-d64a-48fa-9b6f-d825fe7d501c)",thclemensen,7,2
379,ohio,i'm coming home for thanksgiving!,and i'm so excited! i haven't been home in 2 years and i can't wait to see everyone and for my family to meet my bf. it's gonna be amazing to be back!,oreo_cheesecake88,5,33
380,ohio,i live in this country,personally i dont like ohio its just so shaped and also the water is there. it just cant be able to comprehend the high difficulty geometry equations. and the calculus 3 studies. i support the country but its not the best. also it's the smallest country in the state of america other than rome.,z1phs,5,54
