,subreddit_class,title,selftext,author,title_word_count,selftext_word_count
0,ohio,about the donovan lewis police shooting in columbus.,donovan reacted as naturally as anyone would when strangers burst open your bedroom door. there is inherent risk when serving a warrant and going through someone’s home unwelcomed. cops need to recognize this and accept the danger and not shoot people who react naturally. it is common sense.,barelycriminal,8,48
1,ohio,the chokehold jd vance has on my youtube ads.,"no matter how much you tell me about it, i’m not reading hillbilly elegy. but seriously, tim ryan needs to make an ad on there.",dreamsandboxes,9,25
2,ohio,need wedding photographer plzzz,"hi everyone my fiancé and i booked a photographer last year for our wedding for 9/10/22 and we put a deposit down and signed a contract . the past 2 weeks we have called then emailed even txted and haven’t had a response at all . we are a week away from the wedding plzzzz if you know anyone in the columbus ohio area that is willing to help us out plz let me know . 

          brendan",ohiowelder,4,77
3,ohio,ranked choice voting?,"alaska seems to be doing well, when does ohio follow.",titanup1993,3,10
4,ohio,how long is the wait for a handgun purchased from atlantic gun &amp; tackle,"not sure if this is the right place to be asking. but i recently just purchased a handgun from atlantic gun &amp; tackle and they said i could get approved today in the next hour or it could be up to a week but i’ve been seeing people that have waited 3 weeks or longer and still haven’t passed the fbi check. anybody buy a gun from this place without the waiting period? and if you did have to wait, how long was it?",professional_pie4546,14,84
5,ohio,central ohio kroger employees on the verge of voting to strike,"a 40-year kroger employee, who is also a ufcw 1059 steward, told the *free press* that membership’s next vote could be a vote “to strike.”

“in my 40 years we have never voted to strike. we have voted ‘no’ on contracts, but i cannot recall a time when we were going to vote to strike,” they said on the condition of anonymity.

[https://columbusfreepress.com/article/central-ohio-kroger-rank-and-file-could-soon-vote-strike](https://columbusfreepress.com/article/central-ohio-kroger-rank-and-file-could-soon-vote-strike)

&amp;#x200b;

https://preview.redd.it/zyfv1idewal91.jpg?width=1200&amp;format=pjpg&amp;auto=webp&amp;s=b7e1d57cb42a3d72a458addc83a4880dce58c354",cowtowny-johnny,11,65
6,ohio,"dewine is acting too humble on this, his anti-choice victory!","""dewine has also indicated that he would sign legislation to ban all abortions in ohio should the landmark 1973 supreme court ruling be overturned by the present court, as [a leaked draft ruling](https://www.cleveland.com/nation/2022/05/supreme-court-set-to-strike-down-abortion-rights-report.html) suggests it might.""

&amp;#x200b;

&amp;#x200b;

&amp;#x200b;

&amp;#x200b;

[https://www.cleveland.com/news/2022/05/gov-mike-dewine-ohio-will-seek-to-revive-heartbeat-bill-if-supreme-court-overturns-roe-v-wade.html](https://www.cleveland.com/news/2022/05/gov-mike-dewine-ohio-will-seek-to-revive-heartbeat-bill-if-supreme-court-overturns-roe-v-wade.html)

&amp;#x200b;

&amp;#x200b;

&amp;#x200b;

&amp;#x200b;

he's so close, probably going to wait until after the midterm election, but soon all abortions will be banned in ohio. if dewine gets his way.",connect-ad8439,10,71
7,ohio,southeastern ohio is being left out,"ever corner of ohio is getting multi-billion dollar investments except southeastern ohio. i know it’s appalachia we have cheap energy, land, and good location for logistics for the east coast. we also have enough industry to support an investment that size i believe.",adorable_collar_9694,6,43
8,ohio,"can a person register, get a plate, and registration sticker for a used car if they have suspended license?","in ohio, suspended license and a low level warrant.

normal vehicle- honda, have title, and bill of sale

thank you",louisafires,19,20
9,ohio,data shows younger ohioans are registering to vote in big numbers after dobbs decision,"[https://www.wksu.org/government-politics/2022-09-02/data-shows-younger-ohioans-are-registering-to-vote-in-big-numbers-after-dobbs-decision](https://www.wksu.org/government-politics/2022-09-02/data-shows-younger-ohioans-are-registering-to-vote-in-big-numbers-after-dobbs-decision)

 *“58% of those voters who have registered to vote in ohio since the june  24 dobbs decision are under the age of 35, which is a pretty, pretty  significant increase from just before that period,"" bonier said.*

about time? or better late than never??",rural_anomaly,14,45
10,ohio,just everybody chill. greenfield oh,[https://www.youtube.com/watch?v=eqhfuz\_bf2w](https://www.youtube.com/watch?v=eqhfuz_bf2w),beerasore,5,1
11,ohio,question: why do people in ohio park really close together in parking lots even when there’s a huge open parking lot?, ,pavementgrl,21,1
12,ohio,incident at the cuyahoga falls theater-9/3/22,my husband any i just left the cinemark on state road. there were a bunch of people running out and we think we heard someone say gun. 2 police units arrived as we left and we saw several more on their way. we couldn't tell what was going on and we can't find anything about it anywhere.,reginaphilangee,6,57
13,ohio,do you have to take a tour at the ohio caverns?,"i and my boyfriend are looking at going to the ohio caverns and were wondering, do we have to take a tour or are you allowed to explore on your own?",lady_athaea,11,31
14,ohio,the devil in ohio,"netflix released a movie about a cult in amon county ohio (fictional), which begins with a teenage girl running through a cornfield and dangerously stopping a truck hitch a ride to safety taken to a hospital. psychiatrist susan mathis (emily deschanel) discovers that this teenage young girl (mae) [john doe], has an inverted pentagram carved on her back….. 

this story is based on true events but ‘ohio cult’ is completely made up. this movie is inspired by daria polatin bestseller, devil in ohio, which the movie is called by the same name. i must admit that the film is creepy as hell even my wife said, “this is better than what’s playing in theaters.""

researching film i discovered ohio has its gruesome true stories a lot of family murders, satanic cults and small community devilment.",mannagun,4,135
15,ohio,home security cams neo,looking for companies for home security installed i am not tech friendly to do it myself.,ucantcme69,4,16
16,ohio,ohio’s heyday when was ohio’s heyday in the 20th and 21 at century’s. i mean when did ohioans prosper most. and why, ,uniqueshell,22,1
17,ohio,lgbtq+ clubs?,"i’m looking for a peer group. i came out as trans when i was 17 and i am 20, almost 21 now, and i need some friends in person who deal with the same things that i do! i just really need friends in real life to escape to, so any peer group will be great! anyone in the ohio lebanon area that knows where social groups meet up? even if it’s not in lebanon",atleis,2,75
18,ohio,power outage in elyria,is anyone else experiencing it? it sucks that the website is saying investigating. anyone have any clue what happened? things were fine when i left at 11:45 this morning then husband calls around 4 saying the lights aren't turning on.,persephonespring19,4,40
19,ohio,labor day fireworks were awesome who agrees?, ,salty_flight_3872,7,1
20,ohio,question: is there a difference between detroit pizza and ohio pizza?, ,pavementgrl,11,1
21,ohio,"now that the federal government is allowing the states to decide on the legality of abortions, what does that mean for women’s health in ohio - ectopic pregnancies, reproductive rights, criminality, other fallout?", ,cincygirl1717,33,1
22,ohio,a big win for the 4th amendment from ohio.,cleveland state university (a state entity) has been requiring students to take scans of their rooms with their webcams for potential cheating instruments before the students take online tests. if students do not do this scan they will receive no credit for the test. the state had no reason to believe all students in general were cheating let alone doing criminal activity. so the breach of privacy by the state by taking a photographic scan inside a student’s room is not justified. so a constitutionally savvy chemistry student decided to sue the school in federal court for the violation the 4th amendment and the student won.,barelycriminal,9,106
23,ohio,towing laws in ohio?,"hi ohio! i had to leave the state on tuesday for my mothers funeral and received an e-mail on wednesday that cars at one of my apartment’s lot would be towed on friday if they didn’t move for construction. i didn’t see this until today because i’ve been busy with funeral affairs, but realize now they probably have towed my car. i could not have moved it if i wanted to since i’m not in the area. is there any leverage for me getting my apartment to help with the cost? funerals are not cheap and anything would help. thanks i’m advance everyone.",marionberry_mission,4,103
24,ohio,i just need a buddy. a ride or die,hello. i'm 21 and in the zanesville / newark area. i have no friends. well. i have one friend i've had since elementary school but we've really grown apart and are barely what i call friends anymore. i get so bored. everyone i know has friends and even my wife has friends. when she's out doing something or is off on a trip i'm bored and have no one to hang with. i love video games and small trips. i like to do things on the weekend when i'm not working such as visit columbus and play videogames. just message me if you'd like to attempt to be friends. thanks guys.,distantclover,9,111
25,ohio,sexy hot picks :),water is just heated up ice :\],tiny-permit8630,4,7
26,ohio,things to do in ohio for new people,1. leave,panthepan,8,2
27,ohio,can someone show some love please 🙏,"can anybody help me with a couple dollars to get some food for today

please don’t be mean or negative i’m just on hard times and just trying to get by today. i appreciate everything,even if it’s just a dollar. if you can help me my cashapp is    

$4eazyyy (name is emari young)

thank you in advance. i appreciate it all.",juniorplantain1245,7,61
28,ohio,"virtual tour of the trek federation hq in huron, ohio","did you know that the  [international federation of trekkers](https://trekfederation.com) was born in cleveland, ohio? our hq is located in huron, about 20 minutes from cedar point. if you're a star trek fan, we'd love for you to stop by! and for those who can't make it, we've recently created a [virtual tour](https://cloud.threshold360.com/locations/8466310-644139066) that lets you check out our facility from the comfort of home. we hope you enjoy your visit, virtual or otherwise!",trekfederation,10,73
29,ohio,golf,hello i am 20 years old and love golfing. just got into it last summer. i am a 15 handicap. if anyone would want to play sometime let me know. i live close to dover.,backgrounddirt486,1,35
30,ohio,"columbus - free esports tournament w/ osu's braxton miller friday 9/9 6-10pm at belong gaming arena. $1,000 prize pool in fortnite and nba2k23.","i posted this over in r/columbus as well but wanted to put it out to all of ohio in case anyone wants to travel in for this event.

we're hosting a free event with braxton miller this friday at the belong gaming arenas columbus location outside of polaris mall from 6-10pm.

there is a $1,000 prize pool for competitions in fortnite and nba2k23 and we have 72 pcs, ps5s and xboxes where you can play whatever you want. braxton will be playing as well and giving away signed memorabilia.

free pizza, free entry and just a fun time for osu fans and their families or anyone interested in esports and video games.

any questions, give me a shout below!

if interested, please register ahead of time so i have an idea of how many people are attending: https://us.belong.gg/braxtonevent

i'm a columbus local, so if you ever have any questions about the belong arena and esports just give me a shout.",bobonthemove,23,160
31,ohio,general ohio subreddit that isn't primarily focused on politics?,"does such a thing exist. despite agreeing with most of the political post here, i just don't want to see that type of content on reddit and as such, this sub is not the place for me. is there an ohio sub that isn't so focused on politics?",del_pulgarcito,9,48
32,ohio,nice places to get an airbnb cabin 1-3 hours away?,trying to plan a cabin trip but we don’t want to travel too far and we don’t have many ideas. if not we will just have to make the 5+ hour drive to tennessee  😅,jubrauds3,10,35
33,ohio,upvote this no reason, ,saber_dee,4,1
34,ohio,so trump endorsed dewine.,dewine seemed like one of the few sane republican politicians out there. it's unfortunate to see this imo.,thcinnabun,4,18
35,ohio,"preliminary hearing for temporary restraining order of sb 23 ""heartbeat bill"" today","for those who might be interested, there will be a livestream of the hearing on youtube at 1:30p today.

[https://www.youtube.com/watch?v=ydmyssb54vi](https://www.youtube.com/watch?v=ydmyssb54vi)",ap-throwaway1,12,20
36,ohio,check voting registration reminder,"hi! i wanted to post a reminder to check your voting registration status! it took a very long time for my registration to update.

i attempted to update my voting registration/address multiple times online this summer and it did not update. i then sent in my updated information by mail 3-4 weeks ago and the information just updated.",magic_otter,4,58
37,ohio,"aes moving to ""smart meter"" program by 2035",https://www.whio.com/news/local/goodbye-meter-reader-aes-ohio-promising-more-efficient-electric-service-with-smart-meter-program/jtji2b7zb5gknnt44jsvdbkp44/,krovan119,8,1
38,ohio,heart of darkness,"milquetoast mike dewine aka ""i didn't take any nuke graft money, wink, wink"" 

&amp;#x200b;

https://preview.redd.it/w0u478h2tqm91.png?width=1024&amp;format=png&amp;auto=webp&amp;s=4bdf56f6aa109feafcc03aecc72e1570b3a529a4",fun_foot_1947,3,15
39,ohio,ablux couple in black quartz free shipping," **ablux couple in black/gold quartz couples wristwatch valentines anniversary wedding men women.**

**free shipping** ",alaaelayyan,7,14
40,ohio,new friends.,"delete if this isn't aloud please, but i am looking for new friends that are in ohio.",graveyardmattie,2,17
41,ohio,best haunted house/halloween attractions,near or around northeast ohio andddddddd go!,_norhere_northere,4,7
42,ohio,tim ryan's newest ad throwing footballs at tvs is a hoot! think it will work?,[https://twitter.com/timryan/status/1568585673929621506?ref\_src=twsrc%5etfw%7ctwcamp%5etweetembed%7ctwterm%5e1568585673929621506%7ctwgr%5e63b617169fb1dfede91af9cbcda7c16f2d4225b2%7ctwcon%5es1\_&amp;ref\_url=https%3a%2f%2ftimforoh.com%2fhere-they-come-new-tim-ryan-tv-ad-pushes-back-against-bullsht-attacks%2f](https://twitter.com/timryan/status/1568585673929621506?ref_src=twsrc%5etfw%7ctwcamp%5etweetembed%7ctwterm%5e1568585673929621506%7ctwgr%5e63b617169fb1dfede91af9cbcda7c16f2d4225b2%7ctwcon%5es1_&amp;ref_url=https%3a%2f%2ftimforoh.com%2fhere-they-come-new-tim-ryan-tv-ad-pushes-back-against-bullsht-attacks%2f),rural_anomaly,15,1
43,ohio,stupid question: i've got an absentee ballot request form but no stamps...,"hello! i'm a newish oh resident (~1year) in franklin county and i'd like to vote by mail. the return envelope for the absentee request form says a first-class stamp is required, but i don't have stamps. can i just drop off this request form at the board of elections? is there a box i can drop it in or do i have to wait in line and speak with people at a window? what's the process here?",thrwawydisperfectlyf,12,77
44,ohio,so what’s the deal with rita?,"i moved to ohio in 2020. i filed federal and state taxes for 2020 and 2021.
i recently received a subpoena from rita asking for 2020 tax documents or saying i must file with them. 
i’m so confused about this whole process. is this specific to the state of ohio? i’ve lived in 3 other states and never had to file something in addition to state and federal. i’m not understanding why my state taxes aren’t being appropriated to my city/county. 

i live in a different county/city than my employer. they make me put in both cities on the tax form. are they double charging me?

they’re also wanting a portion of 2022 tax paid up front. is this standard?

do they normally wait until a year and a half later to ask for this information? i’m sure there will be penalties and fees since they’re late.

basically i’m just trying to understand the purpose for rita and figure out how to avoid this headache in the future.",ilovemywine,6,168
45,ohio,ohio made me hate america.,i lived in ohio for 27 years and spent most of that time unhappy and always finding things wrong with the world around me. i had traveled quite a bit of the country for years but it wasn’t until i moved to the ne for over a year that i truly started to love where i live. wild feeling. not being surrounded by inbred racists and cigarette stained walmarts can really do a lot for ya.,corn-and-brazed-ohio,5,76
46,ohio,succotash?,"i grew up in nw ohio, kind of right in the middle of nowhere between toledo, ohio and fort wayne, indiana. 

a dish i remember from my childhood - i was born mid 80's for a reference point - was called succotash but when i google that term the recipes don't quite sound the way i remember. 

i remember a mostly corn dish, with tomatoes. it may have been sweetened. it's something i haven't eaten since the 90's easily and my memories are vague and muddy with trauma.  i'm curious if my family just had a bastardization of the original dish that became what our family called succotash? or perhaps it's regional? or maybe it's actually another dish all together errantly called succotash. 

anyone know what i'm talking about? i'm on a quest to recreate some foods of my childhood. i recently learned to make goulash, which is another random childhood dish for me.",dixonsaints,1,154
47,ohio,did you know some school districts in central ohio are allowing churches to pull kids out during their public school day for religious instruction at the expense of other classes?,highly concerning trend. i don’t understand how it’s legal. https://twitter.com/mariabruno01/status/1569460596780990464,dariadarling,30,10
48,ohio,"in your opinion, what is the most quintessential ohio band?","for me, its got to be guided by voices",randy_butterstubs,10,9
49,ohio,dui/ovi lawyers of ohio,"so i was pulled over and arrested for ovi for having a 3 pack of aerosol dusters in my backseat, the arresting officer proceeded to do no tests (field sobriety, breathalyzer, urine, blood, etc) with this being stated how difficult would it be to fight the charge in court. the only evidence of possible huffing was a can being cold but i had just got done cleaning my dash with it.",calebs1101,4,71
50,ohio,"i hate ohio, from michigan gang", ,pvpcatboy,6,1
51,ohio,ohio is the worst state, ,pvpcatboy,5,1
52,ohio,frank larose just denied a fair election in se ohio,"frank larose rejected the democrat nominee for state rep tanya conrath in se ohio yesterday. his office gave a convoluted explanation, but basically he handed the win to his buddy jay. 

se ohio will be once again represented by incumbent republican jay edwards. thanks to gerrymandering, he probably would have won anyway. he’s also good friends with larry householder (and basically a scummy guy if you’ve heard the stories in athens). 

frank larose made sure there wouldn’t be a fair election in se ohio.",supportpublic740,10,84
53,ohio,broken potential,no one truly understand how potential dies without money or resources the most creative minds are those without anything emotional or material..,languagedelicious337,2,22
54,ohio,"goodbye, ohio","goodbye, childhood home.

goodbye, bellwether state. a supposed predictor of what our country could become.

goodbye, midwestern beauty.

goodbye, dreams deferred. 

goodbye, forests and fields, cities and empty streets.

we are defined by our struggle. the constant turmoil and change. the fight between the competing forces of our nation. the battling of the seasons, all to show in this beautiful state.

i wish you well. i have chanted your battle cries in foreign nations, to allies, brothers and sisters of my home.

i choose to be a soldier of fortune and will leave you behind.

i hope, and if i still can, pray, you show me what this state and nation can become.

south, i go. call me back, if you can, with microchips and steel.

harken my return, if you can, ohio. show me the place, i know you can be.",blacbeard1776,2,142
55,ohio,as a ohioan can we sue the state government for unconstitutional votings maps?,just curious as an ohioan who voted for fair and constitutional maps for our legislative districts can we sue the state for not following through. this whole gerrymandering thing is out of control and a blatant middle finger to ohio voters. it is costing the state money and resources that are coming out of our tax dollars because we are having to hold special elections. it is unconstitutional what they are doing and i as an ohio resident is there anything we can do to stop this?,standard_detective49,13,87
56,ohio,cedar point for first time falls out of top 5 rankings of global amusement parks,""" [amusement today this week unveiled its annual golden ticket awards](https://goldenticketawards.com/2022-gta-winners/),  which recognizes the best parks, food, attractions and coasters around  the world, and for the first time since the awards debuted in 1998,  cedar point was not ranked among the top five amusement parks.  
 

the cedar fair property in sandusky took home its share of awards in  individual categories, including nods on the list of top 25 steel  coasters (steel vengeance, no. 2; millenium force, no. 3; maverick, no.  10; magnum, no. 25), but it slipped from familiar ground in the overall  rankings, as it has been doing since it ceded the no. 1 spot it held  from 1998 to 2013. ""

[https://www.clevescene.com/news/cedar-point-falls-out-of-top-five-amusement-park-rankings-for-first-time-in-more-than-20-years-40314236](https://www.clevescene.com/news/cedar-point-falls-out-of-top-five-amusement-park-rankings-for-first-time-in-more-than-20-years-40314236)

kings island in mason, also a cedar fair property like cedar point, was named ""park of the year"" partially to honor its 50-year anniversary.

ranked higher than cedar point in the u.s. were dollywood, universal island of adventure in florida, and silver dollar city in missouri.",buckeyereason,15,160
57,ohio,ohio classic lotto,"what is the ohio classic lotto?

it’s a lottery came in ohio that is drawn 3 times a week monday wednesday and saturday

same days as powerball added,

something seems up to me…. 

jackpot over 30 mill for one state that hasn’t been won in over 2 years might be getting closer to 3 years too, ohio lottery commission doesn’t promote it or advertise for it. also odds to hit jackpot for ohio lotto is 1 in 13,983,816. with the state of ohio’s population being 11.7 some 

just some thoughts.",status-bend-2599,3,90
58,ohio,first time home buyer,"hello everyone, my fiancee and i are preparing to enter the home buying market here soon and wanted to gather some suggestions on mortgage lenders. i am a nurse and we are both first time home owners. i know there are programs for ohio heroes and also first time home buyers, would anyone suggest either of these? we currently reside in newark but are willing to expand outwards about an hour in either direction

&amp;#x200b;

thanks in advance!

\- kris",kami342,4,80
