,subreddit_class,title,selftext,author,title_word_count,selftext_word_count
903,ohio,military code?,anyone else hear that military code on the speakers not too long ago?,entirebase,2,13
904,ohio,ohsaa d vi state championship tv coverage is a choppy mess on spectrum.,"is anyone else having audio and video choppiness problems with this broadcast? ""spnwcih"" channel 1 on my cable box.",imbackdidyoumissme,13,19
905,ohio,immature higher-ups,"greene county is selling the land that includes the industrial park. they are selling the land to the city of xenia so that the commissioners will recieve no backlash for the future plans of the land. 
rumors are, a company that only hires somalian workers have a very high chance of purchasing the land. which means, the somalian workers will be bussed into xenia everyday necessary for work. 
why not get a couple hundred xenians to work?
why do the commissioners have to be so childish and sneaky?
im about to write a letter to somebody who gives a shit. 
",guantis,2,100
906,ohio,tattoo artist search,hey! i'm looking for artists specialized in geometric and dotwork designs at or near the ohio region. here's an example of the artstyle i'm looking for. [https://www.instagram.com/p/bqanoiollid/](https://www.instagram.com/p/bqanoiollid/)i'm not looking for mandala or animal designs. ,vandinite,3,34
907,ohio,what was uo with colerain last night?, ,cannfarmre,7,1
908,ohio,i hate ohio?,i just don’t like ohio you know i just hate it bad weather stupid place ahhhh. i mean let’s just firebomb cleveland or cincinnati or just the whole state i just don’t like it stupid place. i’m shaking from how much i hate ohio ,kipdu,3,44
909,ohio,was anyone else denied their absentee ballot?,"i'm out of the country atm and requested a ballot through ohio's online system two months before the election.

it never arrived. the system says it was sent in early october, and nobody is responding to my emails.

given that republicans are a fraudulent organization trying to steal elections country wide, i must assume this was purposeful. did it happen to anyone else?",pathofexileplayer6,7,63
910,ohio,where's a good place to get a massage in columbus?,"i wanted to get my grandma a massage for christmas and was wondering what the best place to do so would be?
i've never gotten a massage before and don't know much about the process or what to expect and i know online views can be a bit iffy.
so, i want to know if anyone in columbus on here has had a good experience and where they'd reccomend?",phoenixe42,10,69
911,ohio,grand lake question.,"i grew up visiting family on the lake. loved it. unfortunately algea/toxins did what they do.  my question is has it recovered, if not will it? i would love to boat and camp on it again. 


also i think a lot of the problem is shallowness, summer heat, and farm chems. is there a way to fix this? 
",ziro_one,3,58
912,ohio,does anyone know the name/location of this park?,"i remember reading about this park, but i don't remember where in ohio it is or what the name is. the most prominent feature i remember reading about is there is a point in the park with a circular mound, and a small shelter house on top of the mound. i believe the shelter house was a copper color, but can not be sure. anyway you'd walk into this shelter and see into the mound and there were flowers planted in the inside of the circle mound. does anyone know where or even the name of this place?",myalwaysthrowaway,8,98
913,ohio,winter in northeast ohio vs southwest ohio?,are there any noticeable differences between winter weather in these two regions of ohio? especially for cities such as cincinnati or cleveland? if so. . .what are they?,definitely_original,7,28
914,ohio,m/40/near sandusky ohio,"it's just me and my little brother out here at the condo in port clinton looking to have a very small party with one or two lucky ladies...we are both attractive single disease-free relatively sane intelligent and ready to f*** you like you like it and send you home with a smile... if you're interested, send me a message i have kik snapchat and all that so let me know ladies it would definitely be worth your while...",amd1978,3,78
915,ohio,"looking to connect with retired electricians, plumbers, carpenters and more in the columbus area",we need your knowledge! i am looking to connect with retired veterans of every trade who would like to earn some great side money from time to time training our employees. if you or someone you know is retired from a trade of any kind i want to connect with them. there is such a shortage of skilled labor in the work place and we want to start training up the next generation. if you know someone pm me.,pakwolve,14,79
916,ohio,the risk! live show is coming to cleveland and cincinnati and we are looking for ohio storytellers to pitch their stories.,"my name is brad and i am looking for storytellers in your area to pitch true stories from their lives for consideration to be in the risk! live show that is coming to cincinnati on 2/8/19 @ ludlow garage 

theme: surprise

(please note: while risk! like to offer a theme as a launching point for storytellers to brainstorm around, we are much more interested in great stories than we are stories that adhere closely to said theme. alternate theme ideas might be ""what was i thinking?"" or ""secrets."")

i am reaching out to you because i found your contact information while looking up storytelling and comedy organizations in your area. i am hoping you can encourage the storytellers, comedians and performers in your community to pitch us their stories for the chance to perform in our live show.

risk! is a live show and podcast “where people tell true stories they never thought they’d dare to share in public” hosted by kevin allison, of the legendary tv sketch comedy troupe the state. risk! has featured people like janeane garofalo, lisa lampanelli, kevin nealon, margaret cho, marc maron, sarah silverman, and regular folks from around the world, dropping the act and showing a side of themselves we’ve never seen before. the risk! podcast gets over a million downloads each month. slate.com called it “jaw-dropping, hysterically funny, and just plain touching.”

risk! is not like other storytelling shows. it’s “where people tell true stories they never thought they’d dare to share in public.” we encourage our storytellers to step out on a limb, be brutally candid and emotionally raw. this is an uncensored show where taboos are tackled and people talk about things they ordinarily might not share in mixed company, but might save for their therapist.

to hear some of our stories, go to: http://risk-show.com/listen

for more information about what we look for in story pitches and how to submit, go to: [http://risk-show.com/submissions/](http://risk-show.com/submissions/)

**send us your pitch by: 1/4/19** **to be considered! pitches@risk-show.com**

please let the performers in your community know about this exciting opportunity as soon as you can, and let me know if you have any questions!

thank you,

brad

risk!",riskpodcast,21,362
917,ohio,any parks along the ohio river in ne/se ohio?,"i usually go to wheeling wv or marietta oh when i want to see the ohio. 

any places or parks i should check out? thanks! ",xopowo2018,9,25
918,ohio,places to say trip to in ohio?,"i live in columbus and am looking for a cool and interesting place to take one of my friends to as a day trip this saturday. we were thinking maybe a historical place with some cool scenes/museums, or even some place just unique. we are looking to spend most of the day there. keep in mind it’s cold so no hiking or anything, lol. thanks for any suggestions!",theotterlounge,7,68
919,ohio,what’s the point of this,if i can’t post my nsfw pics? tumblr banned me and i thought this would be cool. but no lmao. wtf,mrsrobinson330,5,21
920,ohio,something to do on christmas?,"fiancee and i moved here a year ago to be closer to family and save money over living in florida and love it so far. we don't do anything on christmas day, but this year we're looking to go somewhere. 

is there anywhere in ohio, or close to ohio, that offers something to do on christmas day?",illiteratem8,5,57
921,ohio,moving to oh,"i will be moving to oh within the next few weeks as i'm being stationed at wpafb. i've been looking for places to live in the surrounding area and was hoping for some advice on safe places to move my wife and myself. it's my first time living for an extended period outside my small town of less than 3,000 people so if there's any areas with that rural/small town aspect i'd love to know about them. also a friend of mine who lives in kettering gave me the tip of staying to the east of dayton/miami river, are there any other areas that i should go ahead and rule out? thanks for the help in advance.",jager_vogeljager,3,117
922,ohio,"driving cross country, looking for a place to camp between youngstown and elyria.","this summer my wife and i will be driving cross country and our first night will be spent in oh. coming from ny and think somewhere between youngstown and elyria would be a good time to call it a day. 

would prefer free if possible. it doesn't have to have any amenities because we just need a place to crash for the night. i'm having a hard time looking online because things are either a large campground for rvs with a lot to offer, or far from our route. would go as far as 45 minutes from the highway. any suggestions? ",littlefish90,13,101
923,ohio,is kroger just a cincinnati thing?, ,blinkingobject,6,1
924,ohio,a cleveland browns christmas,a christmas recap of this past season! merry christmas brownies!!!,jmjproduction,4,10
925,ohio,ohio bmv,"so im 18 and looking to take the behind the wheel driving test. if my parents rented a car, and were present during the test. will i be able to take my driving test in a rental car?",1118gideon,2,38
926,ohio,geneva/geneva-on-the-lake,"i'll be staying here in february for a month (long story) and i know it isn't exactly in season but does anyone have any recommendations for things to do? i'm missing the winterfest by a few days, unfortunately.


bonus points if you can recommend places for vegetarians to eat!",elcyis,1,49
927,ohio,abandoned/overgrown places in akron/canton/cleveland area,anyone know of any abandoned/overgrown places in or around canton/akron/cleveland area? i am a photographer would like to document these places before they are lost over time.,beneficial-cucumber1,5,27
928,ohio,i just got pulled over and got a ticket for my drivers license not having my current address. what kind of fine is this? i moved less than 3 months ago., ,encrypt3ddata,31,1
929,ohio,"the co-founder of uber and ex c.e.o of e-trade are opening a no fee cryptocurrency exchange/brokerage firm. they will give you $25 in bitcoin just for joining, as well as $25 per referral. no deposit required! (u.s only) (last day! ends 12:00am est)","the co-founder of uber &amp; ex c.e.o of e-trade are opening a no fee cryptocurrency exchange/brokerage firm by the name of ""voyager"". once it opens in mid january they will give you $25 in bitcoin just for registering now (no deposit required). voyager will also pay you $25 for every person you refer. sign up here: https://vrlps.co/twajqex/cp (u.s only)",redhead149,43,59
930,ohio,color blind people wanted for paid research studies ($30/hour),"the operational based vision assessment (obva) lab at wright-patterson air force base is looking for color blind and color deficient people to participate in paid research studies!  


the studies examine the relationship between color vision and drone operation.   


compensation is $30/hour.  


to participate, you must be a u.s. citizen between the ages of 18 and 65 with a color vision deficiency.   


not sure if you have a color deficiency? come to the lab to find out!  


to sign up for studies, create an account at: [https://obva.sona-systems.com](https://obva.sona-systems.com/)  


to learn more information, visit [http://obvalab.com](http://obvalab.com/)  


after you've created an account, someone will reach out with more information. thank you! 

&amp;#x200b;

//mods, let me know if self promos aren't wanted//

&amp;#x200b;

&amp;#x200b;",obvalab,9,118
931,ohio,ohio beat scene?,"hey, everyone!

are there any beatmakers, or any beat scenes that you know of in ohio?  any style of music is cool!",combokid90,3,22
932,ohio,traveling to see family up north and wanting to surprise my boyfriend with some cool abandoned locations in ohio.,"preferably closer to middletown, ohio. but we could drive anywhere! suggestions please!  i understand some places are guarded more than others but i’d like a place we could get into pretty easy. this trip means the world to me to show him a couple cool places, it’s a birthday trip. he and i both love exploring all types of abandoned things whether it be a place wreckage or even asylums lol 

*also traveling through some of north carolina, kentucky, tennessee, georgia and florida. any other cool ideas we’d love them please! ",phoebe133,19,91
933,ohio,is the popcorn museum in marion worth a visit?,i tried going today but it's closed until march,speedstormer123,9,9
934,ohio,corruption in the ohio house of representatives.,"
https://twitter.com/marissavreyes/status/1081997803914780673?s=21",antifbiohiohouse,7,1
935,ohio,can someone help me figure out portman's voting record?,"a few weeks back i saw in the congresisonal record that rob portman had voted against a clause in a joint resolution that would have prevented us aircraft from refueling saudi aircraft in their strikes on yemen. i contacted his office, which assured me he had voted for the measure.

looking into the record, it became clear portman's office was being less than fully honest. he did vote for joint resolution 54, but against the clause that gave it teeth. so i wrote him about the dishonesty. here's what i just got back:

&gt;this resolution stated clearly that crown prince mohammed bin salman is responsible for the murder of jamal khashoggi and urged the government of the kingdom of saudi arabia to ensure appropriate accountability for all those responsible. it also strongly urged the saudi-led coalition to lead the effort in negotiating an immediate ceasefire in yemen and take concrete steps toward ending this humanitarian crisis. i was proud to support this resolution as it passed the u.s. senate on december 13th, the same day that it was introduced.

yeah, he voted for it, along with 98 other senators, so it's not like it was a brave stance. but take a look at the [agenda] (https://www.senate.gov/legislative/lis/roll_call_lists/vote_menu_115_2.htm) the *previous* day.  portman voted against the motion to let the resolution proceed.

what am i missing? how can portman claim to be in support of this when he voted not only against the only actual action called for in the resolution, but also against even going forward with the vote? can someone better versed in civics walk me through this?",seamonkeydoo2,9,267
936,ohio,hello ohioans,hello from down here in eastern kentucky. our state is superior to ohio by the way. ,southerntillidie,2,16
937,ohio,describe life in se ohio (book research),"so i’m trying to do some setting building for an attempted novel, and i need input. my setting started as the fictional town of eastwood, ohio. had a nice ring to it. then i found out there’s already a real eastwood, ohio, so it’s eastwood falls now. as this idea grew, i had an image of this sort of small-town-in-a-valley, an eerie amalgam of a lot of our rural settings here in north arkansas. a little isolated place with a quaint downtown area on the river, and the rural emptiness surrounding. but because i want to keep things grounded and believable (and because i’m too ocd to just wing it), i need a better grip on what that area is actually like. and because i’m not gonna be able to afford to just travel to ohio anytime during the course of this work, i’ve gotta figure something else out.

so i figured... i’ll ask the people who live there. getting other people’s impressions might make it a bit more caricature, but hell, it’s worth a try.

so eastwood falls is (currently) roughly around washington county. population somewhere between 5-10k: i’ll narrow it in as i go. all the pictures of the woods i’ve seen there look right. anybody here that’s from that general area, or geographically similar areas around the river, can i pick your brain? i’m looking for anything and everything on what small towns are like there, and what small town life is like there. general demographics, industries, culture, etc. what sorts of businesses you have there that are unique, whether franchise or local. what are the people like around there? tell me about the things you like to do that relate to your home. just unload anything you think may be relevant; i need everything i can get.

and thank you in advance for any replies! it means the world to me to get this right.",abel1389,7,319
938,ohio,cincinnati open tennis tournament ticket prices?,"does anyone know ballpark prices for weekend passes are?

thinking about getting my mom and a couple of her friends tickets for her birthday, but ticket prices aren't posted yet. ",highpoweredmutant,6,30
939,ohio,"rubber city doe identified as akron man, michael rogers","a john doe was pulled from the lake near chicago's navy pier on june 10, 2015, and had tattoos that corresponded with cleveland, akron, and ohio state university. he was severely decomposed and initially believed to be asian, then white, and now we know that he was actually african american. he remained unidentified for 3+ years.

old article: https://www.ohio.com/akron/uncategorized/case-file-unidentified-male-possibly-akron


new article about identification: https://www.ohio.com/news/20190108/tattooed-remains-found-in-2015-in-chicago-idd-as-missing-akron-man


his name was michael rogers, a navy veteran, who was born in cleveland, ohio and raised from a young age in akron, ohio, where his family still lives. michael, who would have been 31 now, attended mason elementary school, goodrich middle school and garfield high school, where he played football.


he had not been in contact with his family for several years before his death in 2015, and while we know he drowned, we do not know if it was intentional, accidental or if there was foul play involved. he was very beloved by all who knew him and known as a 'great brother.'


his family has set up a gofundme page, linked in the second article, to pay for his remains to be exhumed from the common grave and brought home to his family in akron, ohio for a proper burial
",goldishspoon,9,206
940,ohio,"rubber city john doe identified as akron man, michael rogers","a john doe was pulled from the lake near chicago's navy pier on june 10, 2015, and had tattoos that corresponded with cleveland, akron, and ohio state university. he was severely decomposed and initially believed to be asian, then white, and now we know that he was actually african american. he remained unidentified for 3+ years.

old article: https://www.ohio.com/akron/uncategorized/case-file-unidentified-male-possibly-akron

new article about identification: https://www.ohio.com/news/20190108/tattooed-remains-found-in-2015-in-chicago-idd-as-missing-akron-man

his name was michael rogers, a navy veteran, who was born in cleveland, ohio and raised from a young age in akron, ohio, where his family still lives. michael, who would have been 31 now, attended mason elementary school, goodrich middle school and garfield high school, where he played football.

he had not been in contact with his family for several years before his death in 2015, and while we know he drowned, we do not know if it was intentional, accidental or if there was foul play involved. he was very beloved by all who knew him and known as a 'great brother.'

his family has set up a gofundme page, linked in the second article, to pay for his remains to be exhumed from the common grave and brought home to his family in akron, ohio for a proper burial
",goldishspoon,10,206
941,ohio,where can you get custom made jewelry?,"i have a bracelet i would like to recreate for an anniversary. it is made of copper,bronze, and steel twisted around each other. i would like to remake it and replace the steel with silver. does anyone know of where i could get work like this done?",avenkal19,7,47
942,ohio,mohican winterfest is this weekend in loudenville,wife wants to see the ice carvings so i guess that's where i'll be saturday. if it's nice a hike around mohican is a possibility.,oag-oag,7,25
943,ohio,where are the best sledding spots in southwest ohio?, ,real_ant,9,1
944,ohio,i posted asking for small town recommendations a few weeks ago and now im ready to start blogging!,"i asked for good small towns in ohio and you all came through. hopefully i can make it to all of them, but here's my first post about cygnet, ohio. population: ~600

let me know what you think!

https://www.lizandslander.com/blog/2018/12/29/small-town-revue-cygnet-ohio",lizandslander,18,39
945,ohio,odd request: any “prominent” figures in southwest ohio willingly to get interviewed?,"my university english class needs me to write an essay on a prominent figure in a community. the essay is more about the community than the member. i know this is a really weird thing to ask, but i thought that i might as well ask the folks here on reddit! dm me in interested 

hopefully the mods don’t take this down…",polarapple,12,62
946,ohio,free ohio abbreviated adult driver's ed for affected fed workers...,if there are any federal workers that happen to fall into the very small group that might need to take the ohio abbreviated driver's ed course to get their driver's license 2cool traffic school is offering their course for free.  just provide pic of last pay stub of $0.00.  [https://www.toocooltrafficschool.com/government-worker-shutdown-partnership/](https://www.toocooltrafficschool.com/government-worker-shutdown-partnership/),boominteractivelrng,10,50
947,ohio,medical marijuana first day sales figures,"[on january 16, 2018, four ohio dispensaries began selling medical marijuana to patients and caregivers. the following are the first day sales figures.  total sales: $75,000 the total volume of product sold: 8.7 pounds](https://medicalmarijuana.ohio.gov/news?articleid=164)

is my math wrong or does that mean price per gram averaged out to $67?",kelpsh4ke,6,49
948,ohio,places to go and thugs to do around willoughby?,"i'm trying to make a ""treasure map"" for q friend who lives in willoughby and i don't know what is cool around there. any pretty parks, trails, restaurants, anything is appreciated!",hucow-cutie,9,31
949,ohio,grocery was crazy busy thursday night,anyone else have the same experience? february's ohio direction card funds (aka food stamps) were released on the 16th due to government shutdown. worried for our neighbors on assistance that now won't get additional funds until march (or maybe later).,labbawabbado,6,40
950,ohio,skiing/snowboarding in northeast ohio,"my wife and i just started getting into winter sports over the last year. we have only ever been to boston mills just southeast of cleveland. we were planning to go there again this upcoming week but i have seen snowtrails mentioned as an alternative. snowtrails is about twice the drive for us.  we are both beginners and wouldn't be taking advantage of the steepest slopes or any moguls,ramps or park stuff. snowtrails would be about an hour drive for us, boston mills about half hour. for those who have been to both, which would you pick? or is there another feasible alternative? thanks.",johnnydontcare,4,104
951,ohio,"to anyone who lives near akron, i have a preference ticket to see dbz broly if you're interested.","just send a pm. i bought it for a long distance friend originally, but unfortunately chose the wrong theater. figured i could find someone who could enjoy the movie from it. ",theoneyoutrusted,18,31
952,ohio,"i’m on a field trip to ne ohio with 25 people, what do we do for a storm?","we’ve never experienced a snow storm,  were from fl.  we are staying in a hotel.  thanks",isthisafreebirf,18,16
953,ohio,i got a golden buckeye card in the mail,"opening it and realizing that next month i will hit 60 was a bit depressing at the time. 

but it had an upside, i was booking campsites yesterday at a couple of state parks (findley and wolf run) and saw a place to enter it on check out

camping fee:$211.00

discounts:$(81.50)

golden buckeye$(81.50)

camping fee:$102.00

discounts:$(30.20)

golden buckeye$(30.20)

maybe it doesn't suck getting old after all. ",zugzub,9,66
954,ohio,ohio weather terrible for cars?,hi i live in columbus. the road salt is real and my car is exposed to the elements 24/7... how many years will the body last before it becomes a rust bucket? it’s a 2016 hyundai crossover. anyway to stop the car from becoming a rust bucket without spending any money? ,vu8,5,51
